{"$schema":"https://json-schema.org/draft/2020-12/schema","type":"object","additionalProperties":false,"required":["name","navigation","home_layout","match_presentation","article_layout","detail_layout","themes","formal_template_id"],"properties":{"name":{"type":"string"},"navigation":{"type":"string"},"home_layout":{"type":"string"},"match_presentation":{"type":"string"},"article_layout":{"type":"string"},"detail_layout":{"type":"string"},"themes":{"const":["light","dark"]},"formal_template_id":{"type":"null"}}}
