{"name":"Match command rail","navigation":"fixed desktop rail / mobile disclosure","home_layout":"rail plus match/news split","match_presentation":"dense two-column match grid","article_layout":"rail-aligned list","detail_layout":"inherited contract body; redesign pending","themes":["light","dark"],"formal_template_id":null}
