{"name":"Editorial sports desk","navigation":"horizontal masthead / mobile disclosure","home_layout":"wide lead then fluid match cards then news","match_presentation":"three-column cards","article_layout":"editorial list","detail_layout":"inherited contract body; redesign pending","themes":["light","dark"],"formal_template_id":null}
